{
  "id": "q26",
  "item": 26,
  "qid": "14892",
  "title": "Eosinophilic esophagitis (biopsy)",
  "system": "GI/Immunology",
  "topic": "Eosinophilic esophagitis",
  "correct": "A",
  "yourAnswer": "A",
  "percentCorrect": 65,
  "vignette": "Atopic 10-year-old (eczema) with solid-food impaction; endoscopy shows stacked ring-like indentations, longitudinal furrows, whitish papules. Biopsy finding?",
  "clues": [
    {
      "text": "atopy + solid-food impaction",
      "type": "red",
      "note": "Eosinophilic esophagitis (EoE)."
    },
    {
      "text": "stacked rings + furrows + white plaques",
      "type": "green",
      "note": "Classic EoE endoscopy (trachealization)."
    }
  ],
  "whatMatters": "EoE -> biopsy shows eosinophilic infiltration of the mucosa (>=15 eos/hpf).",
  "strategy": "Identify the disease from endoscopy + atopy, then recall its histology. Match each option to its disease.",
  "options": [
    {
      "letter": "A",
      "text": "Eosinophilic infiltration of esophageal mucosa",
      "correct": true
    },
    {
      "letter": "B",
      "text": "Ganglionic degeneration of myenteric plexus",
      "correct": false
    },
    {
      "letter": "C",
      "text": "Intestinal metaplasia of esophageal epithelium",
      "correct": false
    },
    {
      "letter": "D",
      "text": "Replacement of esophagus with fibrous tissue",
      "correct": false
    },
    {
      "letter": "E",
      "text": "Squamous cells with eosinophilic intranuclear inclusions",
      "correct": false
    }
  ],
  "eliminations": [
    {
      "letter": "B",
      "what": "Achalasia.",
      "why": "Bird-beak, solids+liquids; no rings/furrows.",
      "correctIf": "Manometry showed absent peristalsis and failed LES relaxation, with both solids AND liquids impacted (achalasia)"
    },
    {
      "letter": "C",
      "what": "Barrett esophagus (GERD).",
      "why": "Adult chronic reflux, goblet cells.",
      "correctIf": "Adult had chronic GERD and biopsy showed columnar metaplasia with goblet cells (Barrett esophagus)"
    },
    {
      "letter": "D",
      "what": "Scleroderma esophagus.",
      "why": "Systemic sclerosis fibrosis, not pediatric EoE.",
      "correctIf": "Patient had Raynaud phenomenon and skin thickening with dilated esophagus (scleroderma)"
    },
    {
      "letter": "E",
      "what": "HSV esophagitis (Cowdry A).",
      "why": "Word trap: 'inclusions' (viral) vs 'infiltration' (EoE).",
      "correctIf": "Immunocompromised patient had esophageal ulcers with eosinophilic intranuclear inclusions (HSV Cowdry A bodies)"
    }
  ],
  "reasoning": [
    "Atopic kid + solid-food impaction + stacked rings/furrows/plaques = EoE",
    "EoE is Th2/IL-5/IL-13, food-antigen driven",
    "Biopsy = eosinophilic infiltration (>=15 eos/hpf) -> A"
  ],
  "mechanism": "EoE: Th2 cells release IL-5/IL-13 -> eosinophils infiltrate the esophageal mucosa (>=15/hpf, white plaques). Chronic inflammation -> rings + furrows -> solid-food dysphagia/impaction. Tx: PPI, swallowed steroids, elimination diet.",
  "keywords": [
    {
      "front": "Atopic kid + food impaction + stacked rings",
      "back": "Eosinophilic esophagitis"
    },
    {
      "front": "EoE biopsy",
      "back": "Eosinophilic infiltration (>=15 eos/hpf)"
    },
    {
      "front": "Bird-beak + loss of ganglion cells",
      "back": "Achalasia"
    },
    {
      "front": "Punched-out ulcers + Cowdry A inclusions",
      "back": "HSV esophagitis"
    }
  ],
  "firstAid": [
    {
      "topic": "Eosinophilic esophagitis",
      "location": "GI > esophageal disorders"
    }
  ],
  "memoryHook": "Atopic kid + food stuck + stacked rings = eosinophils in the wall (infiltration, not inclusions)."
}
