{
  "id": "q23",
  "item": 23,
  "qid": "18666",
  "title": "Pseudocholinesterase deficiency (succinylcholine)",
  "system": "Pharmacology/Genetics",
  "topic": "Neuromuscular blockers",
  "correct": "C",
  "yourAnswer": "B",
  "percentCorrect": 48,
  "vignette": "Patient given succinylcholine (and propofol) before surgery has prolonged paralysis for hours postoperatively. Underlying cause?",
  "clues": [
    {
      "text": "prolonged paralysis after succinylcholine",
      "type": "red",
      "note": "Failure to metabolize succinylcholine."
    }
  ],
  "whatMatters": "Succinylcholine is cleared by plasma pseudocholinesterase; hereditary deficiency (BCHE polymorphism) -> hours of paralysis.",
  "strategy": "Match the drug to its inactivation route. Succinylcholine/mivacurium -> plasma pseudocholinesterase (not liver/kidney/redistribution).",
  "options": [
    {
      "letter": "A",
      "text": "Decreased renal clearance",
      "correct": false
    },
    {
      "letter": "B",
      "text": "Drug redistribution to other tissues",
      "correct": false
    },
    {
      "letter": "C",
      "text": "Genetic polymorphism",
      "correct": true
    },
    {
      "letter": "D",
      "text": "Impaired hepatic function",
      "correct": false
    },
    {
      "letter": "E",
      "text": "Neuromuscular junction autoantibodies",
      "correct": false
    }
  ],
  "eliminations": [
    {
      "letter": "A",
      "what": "Renal elimination.",
      "why": "Wrong route; not renally cleared."
    },
    {
      "letter": "B",
      "what": "That's propofol's offset.",
      "why": "Propofol is a hypnotic, doesn't paralyze."
    },
    {
      "letter": "D",
      "what": "Liver synthesizes the enzyme.",
      "why": "No liver disease; wouldn't last hours."
    },
    {
      "letter": "E",
      "what": "Myasthenia gravis.",
      "why": "Myasthenics are RESISTANT to succinylcholine."
    }
  ],
  "reasoning": [
    "Prolonged paralysis after succinylcholine",
    "Normally cleared by plasma pseudocholinesterase (<10 min)",
    "Hereditary deficiency (BCHE) -> drug lingers at NMJ",
    "Underlying cause = genetic polymorphism -> C"
  ],
  "mechanism": "Pseudocholinesterase (butyrylcholinesterase, BCHE; autosomal recessive) normally degrades ~90% of succinylcholine. Deficiency -> more reaches the NMJ -> prolonged paralysis (hours). Check dibucaine number. Supportive: sedate + ventilate.",
  "keywords": [
    {
      "front": "Prolonged paralysis (hours) after succinylcholine",
      "back": "Pseudocholinesterase deficiency"
    },
    {
      "front": "Gene & inheritance",
      "back": "BCHE, autosomal recessive"
    },
    {
      "front": "Propofol offset mechanism",
      "back": "Redistribution (brain -> tissues)"
    },
    {
      "front": "Anti-AChR antibodies",
      "back": "Myasthenia gravis (resistant to sux)"
    }
  ],
  "firstAid": [
    {
      "topic": "Succinylcholine / pseudocholinesterase",
      "location": "Pharm > neuromuscular blockers"
    }
  ],
  "memoryHook": "Succinylcholine won't quit = pseudocholinesterase can't split."
}