{
  "id": "q29",
  "item": 29,
  "qid": "18866",
  "title": "Urge incontinence: beta-3 agonist",
  "system": "Renal/Pharm",
  "topic": "Urinary incontinence",
  "correct": "E",
  "yourAnswer": "F",
  "percentCorrect": 40,
  "vignette": "80-year-old with urgency -> immediate leakage, nocturia, mild cognitive impairment; no leak with cough/Valsalva, normal postvoid residual. Which pharmacodynamic effect helps?",
  "clues": [
    {
      "text": "urgency -> immediate leakage, normal PVR",
      "type": "red",
      "note": "Urge incontinence (overactive bladder)."
    },
    {
      "text": "cognitive impairment",
      "type": "blue",
      "note": "Avoid antimuscarinics (worsen cognition) -> prefer beta-3 agonist."
    },
    {
      "text": "no leak with cough/Valsalva",
      "type": "green",
      "note": "Rules out stress incontinence."
    }
  ],
  "whatMatters": "Urge incontinence = relax the detrusor. Options: antimuscarinic or beta-3 agonist. With cognitive impairment, prefer beta-3 stimulation (mirabegron).",
  "strategy": "Bladder wiring: M3 contracts detrusor, beta-3 relaxes detrusor, alpha-1 contracts internal sphincter. Watch the verb (stimulation vs antagonism).",
  "options": [
    {
      "letter": "A",
      "text": "Antagonism of alpha-1 adrenergic receptors",
      "correct": false
    },
    {
      "letter": "B",
      "text": "Antagonism of beta-1 adrenergic receptors",
      "correct": false
    },
    {
      "letter": "C",
      "text": "Antagonism of beta-3 adrenergic receptors",
      "correct": false
    },
    {
      "letter": "D",
      "text": "Stimulation of beta-1 adrenergic receptors",
      "correct": false
    },
    {
      "letter": "E",
      "text": "Stimulation of beta-3 adrenergic receptors",
      "correct": true
    },
    {
      "letter": "F",
      "text": "Stimulation of muscarinic cholinergic receptors",
      "correct": false
    }
  ],
  "eliminations": [
    {
      "letter": "A",
      "what": "Relaxes sphincter (BPH).",
      "why": "Would worsen leakage.",
      "correctIf": "Patient had STRESS incontinence from urethral hypermobility (alpha-1 agonist to tighten sphincter is correct there)"
    },
    {
      "letter": "B",
      "what": "Cardiac.",
      "why": "No bladder role.",
      "correctIf": "Patient had heart failure or sinus bradycardia requiring cardiac beta-1 receptor intervention"
    },
    {
      "letter": "C",
      "what": "Backwards.",
      "why": "Blocking beta-3 promotes contraction.",
      "correctIf": "Patient had OVERFLOW incontinence from detrusor underactivity (contracting the muscle, not relaxing it, is needed)"
    },
    {
      "letter": "D",
      "what": "Cardiac inotrope.",
      "why": "No bladder effect.",
      "correctIf": "Patient had symptomatic bradycardia or low cardiac output (beta-1 cardiac question, not urologic)"
    },
    {
      "letter": "F",
      "what": "Contracts detrusor (bethanechol).",
      "why": "Opposite of what you want; worsens urge. Trap.",
      "correctIf": "Patient had urinary RETENTION from neurogenic bladder underactivity (bethanechol contracts detrusor — needed there)"
    }
  ],
  "reasoning": [
    "Urgency -> immediate leak, normal PVR, no Valsalva leak = urge incontinence",
    "Goal = relax the detrusor",
    "Options: antimuscarinic OR beta-3 agonist; cognitive impairment -> avoid antimuscarinics",
    "Best effect = beta-3 stimulation (mirabegron) -> E"
  ],
  "mechanism": "Urge incontinence = involuntary detrusor contractions. Beta-3 agonists (mirabegron) relax detrusor; antimuscarinics block M3 contraction but worsen cognition in the elderly. M3 contracts (void), beta-3 relaxes (store), alpha-1 contracts sphincter (store).",
  "keywords": [
    {
      "front": "Urgency -> immediate leak, normal PVR",
      "back": "Urge incontinence (overactive bladder)"
    },
    {
      "front": "Beta-3 agonist for urge incontinence",
      "back": "Mirabegron (relaxes detrusor)"
    },
    {
      "front": "Avoid in elderly/cognitive impairment",
      "back": "Antimuscarinics (oxybutynin) -> confusion"
    },
    {
      "front": "Leak with cough/Valsalva",
      "back": "Stress incontinence"
    }
  ],
  "firstAid": [
    {
      "topic": "Urinary incontinence",
      "location": "Renal/Pharm > incontinence types; bladder autonomic pharmacology"
    }
  ],
  "memoryHook": "Beta-3 Brakes the Bladder."
}
