{
  "id": "q01",
  "item": 1,
  "qid": "1418",
  "title": "Lagging strand: Okazaki fragments",
  "system": "Biochemistry",
  "topic": "DNA replication",
  "correct": "E",
  "yourAnswer": "E",
  "percentCorrect": 65,
  "vignette": "A 4-year-old with ALL (fatigue, bone pain, lymphadenopathy, purpura, anemia/thrombocytopenia, blasts on smear) starts doxorubicin, which intercalates DNA and blocks replication at the fork. Which feature is unique to the daughter strand synthesized OPPOSITE the growing fork (the lagging strand)?",
  "clues": [
    {
      "text": "opposite direction of the growing fork",
      "type": "purple",
      "note": "= the lagging strand; built 5'->3' away from the fork, so it must be discontinuous."
    },
    {
      "text": "doxorubicin intercalates DNA",
      "type": "blue",
      "note": "Anthracycline; key toxicity = dilated cardiomyopathy (prevent with dexrazoxane)."
    }
  ],
  "whatMatters": "The clinical ALL story is window dressing. The testable point: lagging strand = discontinuous synthesis = Okazaki fragments.",
  "strategy": "For replication questions, separate leading (continuous) vs lagging (discontinuous). DNA pol only builds 5'->3'.",
  "options": [
    {
      "letter": "A",
      "text": "3'->5' exonuclease activity (proofreading)",
      "correct": false
    },
    {
      "letter": "B",
      "text": "3'->5' polymerase activity",
      "correct": false
    },
    {
      "letter": "C",
      "text": "5'->3' exonuclease activity",
      "correct": false
    },
    {
      "letter": "D",
      "text": "RNA primer synthesis before DNA",
      "correct": false
    },
    {
      "letter": "E",
      "text": "Synthesis of multiple, short DNA fragments",
      "correct": true
    }
  ],
  "eliminations": [
    {
      "letter": "A",
      "what": "Proofreading exonuclease.",
      "why": "Occurs on BOTH strands, not unique to lagging."
    },
    {
      "letter": "B",
      "what": "No polymerase synthesizes 3'->5'.",
      "why": "Doesn't exist."
    },
    {
      "letter": "C",
      "what": "Removes RNA primers.",
      "why": "Happens on both strands."
    },
    {
      "letter": "D",
      "what": "Primer needed to start synthesis.",
      "why": "Both strands need a primer (leading: one; lagging: many)."
    }
  ],
  "reasoning": [
    "Doxorubicin blocks replication -> 2 daughter strands",
    "'Opposite direction of fork' = lagging strand",
    "DNA pol only 5'->3' -> lagging built discontinuously",
    "Discontinuous = multiple short Okazaki fragments -> E"
  ],
  "mechanism": "DNA polymerase extends only 5'->3'. The lagging strand template runs 5'->3' toward the fork, so its new strand grows AWAY from the fork as short Okazaki fragments, each primed by RNA; RNase H/FEN1 remove primers and DNA ligase seals nicks.",
  "keywords": [
    {
      "front": "Synthesized away from the replication fork",
      "back": "Lagging strand"
    },
    {
      "front": "Multiple short DNA fragments",
      "back": "Okazaki fragments"
    },
    {
      "front": "Joins Okazaki fragments",
      "back": "DNA ligase"
    },
    {
      "front": "Removes RNA primer",
      "back": "5'->3' exonuclease (RNase H / FEN1)"
    }
  ],
  "firstAid": [
    {
      "topic": "DNA replication",
      "location": "Biochemistry > Molecular > replication fork diagram, Okazaki fragments, enzymes table"
    }
  ],
  "memoryHook": "LAGging makes baGs of fraGments — lagging strand = Okazaki pieces."
}