{
  "id": "q02",
  "item": 2,
  "qid": "8424",
  "title": "Adrenal medulla activated by acetylcholine",
  "system": "Endocrine/Anatomy",
  "topic": "Adrenal medulla / ANS",
  "correct": "A",
  "yourAnswer": "E",
  "percentCorrect": 40,
  "vignette": "Histology of an adrenal gland; the arrow points to the deep, basophilic (blue-purple) layer = adrenal medulla. Which substance directly activates these cells?",
  "clues": [
    {
      "text": "arrow at deep basophilic layer",
      "type": "red",
      "note": "= adrenal medulla (chromaffin cells). The pink cortex sits above it."
    },
    {
      "text": "directly activated",
      "type": "purple",
      "note": "Asks for the INPUT to the cell, not its output."
    }
  ],
  "whatMatters": "Identify the layer (medulla), then recall its physiologic input. Chromaffin cells = modified postganglionic sympathetic neurons.",
  "strategy": "'Directly activated by' = the neurotransmitter arriving at the cell, never the substance the cell secretes.",
  "options": [
    {
      "letter": "A",
      "text": "Acetylcholine",
      "correct": true
    },
    {
      "letter": "B",
      "text": "ACTH",
      "correct": false
    },
    {
      "letter": "C",
      "text": "Angiotensin II",
      "correct": false
    },
    {
      "letter": "D",
      "text": "Epinephrine",
      "correct": false
    },
    {
      "letter": "E",
      "text": "Norepinephrine",
      "correct": false
    }
  ],
  "eliminations": [
    {
      "letter": "B",
      "what": "Drives the cortex (cortisol).",
      "why": "Arrow is on the medulla."
    },
    {
      "letter": "C",
      "what": "Drives zona glomerulosa (aldosterone).",
      "why": "Wrong layer (outermost cortex)."
    },
    {
      "letter": "D",
      "what": "Medulla's main product (~80%).",
      "why": "Output, not the activator."
    },
    {
      "letter": "E",
      "what": "Also a product/secretion.",
      "why": "Output, not input; the cell IS the postganglionic neuron."
    }
  ],
  "reasoning": [
    "Arrow = adrenal medulla",
    "Chromaffin cells = modified postganglionic sympathetic neurons",
    "Their input is the preganglionic fiber (cholinergic)",
    "Direct activator = ACh on nicotinic receptors -> A"
  ],
  "mechanism": "The adrenal medulla is a 'giant sympathetic ganglion': preganglionic splanchnic fibers synapse directly on chromaffin cells and release ACh onto nicotinic receptors, triggering epinephrine/NE release.",
  "keywords": [
    {
      "front": "Deep basophilic adrenal layer",
      "back": "Medulla (chromaffin cells)"
    },
    {
      "front": "Directly activates adrenal medulla",
      "back": "Acetylcholine -> nicotinic receptors"
    },
    {
      "front": "Chromaffin cell identity",
      "back": "Modified postganglionic sympathetic neuron"
    },
    {
      "front": "Zona glomerulosa stimulator",
      "back": "Angiotensin II"
    }
  ],
  "firstAid": [
    {
      "topic": "Adrenal gland",
      "location": "Endocrine > Anatomy/Physiology > cortex zones (GFR) + medulla"
    },
    {
      "topic": "Autonomic NS",
      "location": "Neuro/Physio > preganglionic fibers cholinergic; medulla = sympathetic exception"
    }
  ],
  "memoryHook": "The medulla is a giant sympathetic ganglion — preganglionic ACh fires it."
}